{
  "$schema": "../profiles/profile.schema.json",
  "name": "Upmix stéréo vers 5.1",
  "description": "Source stéréo redistribuée sur 5.1 (layout latéral 0x60F) : avant intact, centre (L+R)/2 à -3 dB, surrounds à -6 dB, LFE dérivé par passe-bas 120 Hz à -6 dB. Réglages conservateurs, pas de prétention spatiale.",
  "mode": "Upmix2to6",
  "sampleRate": 48000,
  "inputMask": 3,
  "outputMask": 1551,
  "masterGainDb": 0,
  "channelGainDb": [0, 0, 0, 0, 0, 0, 0, 0],
  "channelDelayMs": [0, 0, 0, 0, 0, 0, 0, 0],
  "channelMute": [false, false, false, false, false, false, false, false],
  "upmix": {
    "centerGainDb": -3,
    "surroundGainDb": -6,
    "deriveLfe": true,
    "lfeGainDb": -6,
    "lfeLowPassHz": 120
  },
  "bassManagement": { "enabled": false, "crossoverHz": 80, "highPassSatellites": true, "sumToLfe": true, "sumToLfeGainDb": 0 },
  "limiter": { "enabled": true, "ceilingDb": -0.3, "releaseMs": 80 },
  "gainRampMs": 20,
  "maxDelayMs": 50
}
